address;region;city;okato;oktmo;timezone;geo_lat;geo_lon;population;foundation_year
Краснодарский край, г. Гулькевичи;26;Гулькевичи;3213501000;3613101001;UTC+3;45.3605121;40.6918389;35225;1875
Краснодарский край, г. Ейск;26;Ейск;3411000000;3616101001;UTC+3;46.71157;38.2763895;87771;1848
Краснодарский край, г. Кореновск;26;Кореновск;3221501000;3621101001;UTC+3;45.4641703;39.458949;41179;1794
г. Краснодар;26;Краснодар;3401000000;3701000001;UTC+3;45.0401604;38.9759647;744933;1793
Краснодарский край, Кавказский р-н, г. Кропоткин;26;Кропоткин;3414000000;3618101001;UTC+3;45.4333007;40.5727951;80743;1879
Краснодарский край, г. Крымск;26;Крымск;3415000000;3625101001;UTC+3;44.9344404;37.9855795;57370;1862
Краснодарский край, г. Курганинск;26;Курганинск;3227501000;3627101001;UTC+3;44.8877025;40.5913245;47974;1855
Краснодарский край, г. Лабинск;26;Лабинск;3417000000;3630101001;UTC+3;44.6354363;40.7245341;62822;1841
Краснодарский край, г. Новокубанск;26;Новокубанск;3234501000;3634101001;UTC+3;45.1038699;41.0475175;34847;1867
Краснодарский край, г. Новороссийск;26;Новороссийск;3420000000;3720000001;UTC+3;44.7235026;37.7686135;241788;1838
Краснодарский край, г. Приморско-Ахтарск;26;Приморско-Ахтарск;3241501000;3641101001;UTC+3;46.0515432;38.1704875;32253;1854
Краснодарский край, г. Славянск-на-Кубани;26;Славянск-на-Кубани;3423000000;3645101001;UTC+3;45.2603626;38.1259774;63768;1865
Краснодарский край, г. Сочи;26;Сочи;3426000000;3726000;UTC+3;43.5854551;39.7231548;343285;1838
Краснодарский край, г. Темрюк;26;Темрюк;3251501000;3651101001;UTC+3;45.2610949;37.4454412;38014;1860
Краснодарский край, г. Тимашевск;26;Тимашевск;3253501000;3653101001;UTC+3;45.615923;38.9351837;53921;1794
Краснодарский край, г. Тихорецк;26;Тихорецк;3429000000;3654101001;UTC+3;45.8546345;40.1260267;61825;1895
Краснодарский край, г. Туапсе;26;Туапсе;3432000000;3655101001;UTC+3;44.1105335;39.0824904;63233;1838
Краснодарский край, г. Усть-Лабинск;26;Усть-Лабинск;3257501000;3657101001;UTC+3;45.2227359;39.6929577;43268;1794
Краснодарский край, Апшеронский р-н, г. Хадыженск;26;Хадыженск;3205509000;3605109001;UTC+3;44.4122963;39.5320258;21580;1864
Красноярский край, Курагинский р-н, г. Артемовск;27;Артемовск;4230502000;4630102;UTC+7;54.3473075;93.4358377;2180;1700
Красноярский край, г. Ачинск;27;Ачинск;4403000000;4703000001;UTC+7;56.253907;90.4794397;109156;1683
Красноярский край, г. Боготол;27;Боготол;4406000000;4706000001;UTC+7;56.2098468;89.5299336;21029;1893
Красноярский край, г. Бородино;27;Бородино;4407000000;4707000001;UTC+7;55.9054121;94.9020967;17423;1949
Красноярский край, г. Дивногорск;27;Дивногорск;4409000000;4709000001;UTC+7;55.9576784;92.3800687;28271;1956
Красноярский край, г. Дудинка;27;Дудинка;4253501000;4653101001;UTC+7;69.4031364;86.1907218;22207;1667
Красноярский край, г. Енисейск;27;Енисейск;4412000000;4712000001;UTC+7;58.4485261;92.1651083;18769;1619
Красноярский край, г. Железногорск;27;Железногорск;4535000000;4735000001;UTC+7;56.2529035;93.532273;85559;1950
Красноярский край, Рыбинский р-н, г. Заозерный;27;Заозерный;4247501000;4647101001;UTC+7;55.9617752;94.7091491;10683;1776
Красноярский край, г. Зеленогорск;27;Зеленогорск;4537000000;4737000001;UTC+7;56.1131564;94.5888103;66018;1956
Красноярский край, Туруханский р-н, г. Игарка;27;Игарка;4254501000;4654117001;UTC+7;67.4666901;86.5812794;6183;1929
Красноярский край, г. Иланский;27;Иланский;4218501000;4618101001;UTC+7;56.2374037;96.067267;16108;1646
Красноярский край, г. Канск;27;Канск;4420000000;4720000001;UTC+7;56.2051282;95.7051096;94230;1636
Красноярский край, г. Кодинск;27;Кодинск;4224501000;4624101;UTC+7;58.6032644;99.1797962;14835;1977
г. Красноярск;27;Красноярск;4401000000;4701000;UTC+7;56.0093879;92.8524806;973826;1628
Красноярский край, г. Лесосибирск;27;Лесосибирск;4422000000;4722000001;UTC+7;58.221681;92.5037872;61146;1975
Красноярский край, г. Минусинск;27;Минусинск;4423000000;4723000001;UTC+7;53.7104586;91.6872907;71171;1739
Красноярский край, г. Назарово;27;Назарово;4426000000;4726000001;UTC+7;56.0113799;90.4168775;52829;1700
Красноярский край, г. Норильск;27;Норильск;4429000000;4729000001;UTC+7;69.3489978;88.2009846;175301;1935
Красноярский край, г. Сосновоборск;27;Сосновоборск;4433000000;4733000001;UTC+7;56.1202647;93.3354121;33090;1971
Красноярский край, г. Ужур;27;Ужур;4256501000;4656101001;UTC+7;55.3141969;89.8333918;16079;1760
Красноярский край, г. Уяр;27;Уяр;4257501000;4657101001;UTC+7;55.8131263;94.3282601;12666;1760
Красноярский край, г. Шарыпово;27;Шарыпово;4440000000;4740000;UTC+7;55.5389739;89.1801044;38570;XVIII век
Респ Крым, г. Ялта, г. Алупка;12;Ялта;35419503000;35729000001;UTC+3;44.4164605;34.0444797;7771;960
Респ Крым, г. Алушта;12;Алушта;35403000000;35703000;UTC+3;44.6764304;34.4100624;29078;6 век
Респ Крым, г. Армянск;12;Армянск;35405000000;35706000001;UTC+3;46.1059307;33.6910012;21987;1736
Респ Крым, Бахчисарайский р-н, г. Бахчисарай;12;Бахчисарай;35204501000;35604101001;UTC+3;44.7514769;33.8752176;27448;1532
Респ Крым, Белогорский р-н, г. Белогорск;12;Белогорск;35207501000;35607101001;UTC+3;45.057202;34.5999029;16354;13 век
Респ Крым, г. Джанкой;12;Джанкой;35407000000;35709000001;UTC+3;45.7092306;34.3883372;38622;1784
Респ Крым, г. Евпатория;12;Евпатория;35409000000;35712000001;UTC+3;45.190629;33.367634;105719;497 год до н. э.
Респ Крым, г. Керчь;12;Керчь;35412000000;35715000001;UTC+3;45.3562627;36.4674513;147033;7 — 6 век до н. э.
Респ Крым, г. Красноперекопск;12;Красноперекопск;35413000000;35718000001;UTC+3;45.9537576;33.7921939;26268;1932
Респ Крым, г. Саки;12;Саки;35414000000;35721000001;UTC+3;45.1341997;33.6033383;25146;1952
Респ Крым, г. Симферополь;12;Симферополь;35401000000;35701000001;UTC+3;44.9482948;34.1001151;332317;1784
Респ Крым, Кировский р-н, г. Старый Крым;12;Старый Крым;35216504000;35616104001;UTC+3;45.029058;35.0901474;9277;13 век
Респ Крым, г. Судак;12;Судак;35416000000;35723000001;UTC+3;44.8504679;34.9762034;16492;212
Респ Крым, г. Феодосия;12;Феодосия;35417000000;35726000001;UTC+3;45.0318393;35.3824259;69038;VI век до н. э.
Респ Крым, Ленинский р-н, г. Щелкино;12;Щелкино;35227505000;35627105001;UTC+3;45.4288991;35.825165;10620;1978
Респ Крым, г. Ялта;12;Ялта;35419000000;35729000001;UTC+3;44.4953612;34.166308;76746;1154
Курганская обл, г. Далматово;48;Далматово;37208501000;37608101001;UTC+5;56.262114;62.9387011;13913;1644
Курганская обл, г. Катайск;48;Катайск;37212501000;37612101001;UTC+5;56.290809;62.5800359;14017;1655
г. Курган;48;Курган;37401000000;37701000;UTC+5;55.4443883;65.3161963;333640;1679
Курганская обл, г. Куртамыш;48;Куртамыш;37216501000;37616101;UTC+5;54.9368539;64.4203722;17098;1745
Курганская обл, г. Макушино;48;Макушино;37220501000;37620101;UTC+5;55.2153947;67.2451705;8337;1797
Курганская обл, г. Петухово;48;Петухово;37226501000;37626101;UTC+5;55.0650077;67.8873408;11291;1779
Курганская обл, г. Шадринск;48;Шадринск;37405000000;37705000;UTC+5;56.0870344;63.6297182;77744;1662
Курганская обл, г. Шумиха;48;Шумиха;37242501000;37642101;UTC+5;55.2280246;63.2901272;17821;1892
Курганская обл, г. Щучье;48;Щучье;37244501000;37644101;UTC+5;55.2087637;62.7478548;10971;1750
Курская обл, Дмитриевский р-н, г. Дмитриев;49;Дмитриев;38208501000;38608101;UTC+3;52.1268464;35.0739038;7721;1779
Курская обл, г. Железногорск;49;Железногорск;38405000000;38705000;UTC+3;52.3380202;35.3516867;95057;1957
г. Курск;49;Курск;38401000000;38701000;UTC+3;51.7303637;36.1925603;414595;1032
Курская обл, г. Курчатов;49;Курчатов;38408000000;38708000;UTC+3;51.6604083;35.6572224;42691;1968
Курская обл, г. Льгов;49;Льгов;38410000000;38710000001;UTC+3;51.6597148;35.2612491;21452;1152
Курская обл, г. Обоянь;49;Обоянь;38226501000;38626101001;UTC+3;51.2119324;36.2755133;13562;1639
Курская обл, г. Рыльск;49;Рыльск;38234501000;38634101001;UTC+3;51.5681314;34.6802597;15667;1152
Курская обл, г. Суджа;49;Суджа;38240501000;38640101001;UTC+3;51.1918927;35.2720915;6036;XVI век
Курская обл, г. Фатеж;49;Фатеж;38244501000;38644101;UTC+3;52.0917728;35.8538706;5404;XVI век
Курская обл, г. Щигры;49;Щигры;38415000000;38715000;UTC+3;51.8786014;36.8910945;17043;XVIII век
Ленинградская обл, г. Бокситогорск;50;Бокситогорск;41203501000;41603101;UTC+3;59.4734797;33.845688;16593;1929
Ленинградская обл, г. Волосово;50;Волосово;41206501000;41606101001;UTC+3;59.4445408;29.4923355;12162;1870
Ленинградская обл, г. Волхов;50;Волхов;41209501000;41609101;UTC+3;59.9005958;32.3520756;47344;1918
Ленинградская обл, г. Всеволожск;50;Всеволожск;41212501000;41612101001;UTC+3;60.0191278;30.6456718;59689;1892
Ленинградская обл, г. Выборг;50;Выборг;41215501000;41615101001;UTC+3;60.7130801;28.7328336;80013;1293
Ленинградская обл, Выборгский р-н, г. Высоцк;50;Высоцк;41215504000;41615104;UTC+3;60.6296236;28.5709314;1244;1532
Ленинградская обл, г. Гатчина;50;Гатчина;41218501000;41618101001;UTC+3;59.565237;30.1282473;92566;1499
Ленинградская обл, Кингисеппский р-н, г. Ивангород;50;Ивангород;41221505000;41621102;UTC+3;59.3766119;28.2231659;9797;1492
Ленинградская обл, Выборгский р-н, г. Каменногорск;50;Каменногорск;41215506000;41615106;UTC+3;60.950855;29.1308372;6761;1597
Ленинградская обл, г. Кингисепп;50;Кингисепп;41221501000;41621101;UTC+3;59.3740435;28.6112444;48667;1384
Ленинградская обл, г. Кириши;50;Кириши;41224501000;41624101;UTC+3;59.4742862;32.0624947;52826;1693
Ленинградская обл, г. Кировск;50;Кировск;41225501000;41625101001;UTC+3;59.8754216;30.981364;25633;1931
Ленинградская обл, Гатчинский р-н, г. Коммунар;50;Коммунар;41218505000;41618105001;UTC+3;59.6215133;30.3934125;20265;1840-е
Ленинградская обл, Всеволожский р-н, г. Кудрово;50;Кудрово;41212812002;41612155005;UTC+3;59.9075226;30.5121008;13501[4];1926
Ленинградская обл, г. Лодейное Поле;50;Лодейное Поле;41227501000;41627101001;UTC+3;60.7320936;33.5521022;21053;1702
Ленинградская обл, г. Луга;50;Луга;41233501000;41633101;UTC+3;58.7374031;29.8465776;36409;1777
Ленинградская обл, Тосненский р-н, г. Любань;50;Любань;41248505000;41648105;UTC+3;59.3493847;31.2484801;4188;1499
Ленинградская обл, Всеволожский р-н, г. Мурино;50;Мурино;41212000101;41612428101;UTC+3;60.044862;30.4571456;19775[4];1676
Ленинградская обл, Тосненский р-н, г. Никольское;50;Никольское;41248508000;41648108;UTC+3;59.7043309;30.7874571;19345;1710
Ленинградская обл, Волховский р-н, г. Новая Ладога;50;Новая Ладога;41209504000;41609104;UTC+3;60.1100135;32.3141203;8890;1704
Ленинградская обл, Кировский р-н, г. Отрадное;50;Отрадное;41225504000;41625104;UTC+3;59.7726848;30.7988557;23874;1708
Ленинградская обл, Бокситогорский р-н, г. Пикалево;50;Пикалево;41203505000;41603102;UTC+3;59.5132022;34.1772776;21567;1620
Ленинградская обл, г. Подпорожье;50;Подпорожье;41236501000;41636101001;UTC+3;60.9127549;34.1567664;18729;1936
Ленинградская обл, Выборгский р-н, г. Приморск;50;Приморск;41215508000;41615108;UTC+3;60.3660209;28.6135772;6122;1268
Ленинградская обл, г. Приозерск;50;Приозерск;41239501000;41639101001;UTC+3;61.0330896;30.1587851;18929;XII век
Ленинградская обл, Выборгский р-н, г. Светогорск;50;Светогорск;41215514000;41615114;UTC+3;61.1111282;28.8725865;15973;1887
Ленинградская обл, Всеволожский р-н, г. Сертолово;50;Сертолово;41212505000;41612102001;UTC+3;60.1446932;30.2095918;47854;1936
Ленинградская обл, г. Сланцы;50;Сланцы;41242501000;41642101;UTC+3;59.1178185;28.0881475;33587;1934
Ленинградская обл, г. Сосновый Бор;50;Сосновый Бор;41454000000;41754000;UTC+3;59.8772884;29.1291619;65901;1958
Ленинградская обл, Волховский р-н, г. Сясьстрой;50;Сясьстрой;41209508000;41609108;UTC+3;60.1401739;32.5601559;13747;1926
Ленинградская обл, г. Тихвин;50;Тихвин;41245501000;41645101001;UTC+3;59.6272904;33.5072731;58843;1383
Ленинградская обл, г. Тосно;50;Тосно;41248501000;41648101001;UTC+3;59.5407098;30.877812;39127;1500
Ленинградская обл, Кировский р-н, г. Шлиссельбург;50;Шлиссельбург;41225503000;41625102;UTC+3;59.9443714;31.0333365;13305;1323
Липецкая обл, г. Грязи;51;Грязи;42206501000;42606101001;UTC+3;52.4874097;39.9331142;46798;1868
Липецкая обл, г. Данков;51;Данков;42209501000;42609101;UTC+3;53.2577411;39.1456184;21056;1563
Липецкая обл, г. Елец;51;Елец;42415000000;42715000;UTC+3;52.6152411;38.5289342;108404;1146
Липецкая обл, г. Задонск;51;Задонск;42224501000;42624101;UTC+3;52.4004179;38.9205032;9695;1615
Липецкая обл, г. Лебедянь;51;Лебедянь;42233501000;42633101;UTC+3;53.0156117;39.143536;20991;1605
г. Липецк;51;Липецк;42401000000;42701000;UTC+3;52.610249;39.5947883;508124;1703
Липецкая обл, г. Усмань;51;Усмань;42248501000;42648101;UTC+3;52.0442648;39.726401;18752;1645
Липецкая обл, г. Чаплыгин;51;Чаплыгин;42256501000;42656101;UTC+3;53.24048;39.9670973;12656;1638
г. Магадан;52;Магадан;44401000000;44701000001;UTC+11;59.5681332;150.8084956;95925;1929
Магаданская обл, г. Сусуман;52;Сусуман;44213501000;44713000001;UTC+11;62.7805882;148.1540281;5865;1938
Респ Марий Эл, г. Волжск;13;Волжск;88405000000;88705000;UTC+3;55.8623156;48.3715083;55671;XVI век
Респ Марий Эл, г. Звенигово;13;Звенигово;88212501000;88612101;UTC+3;55.9738571;48.0170245;11945;1860
г. Йошкар-Ола;13;Йошкар-Ола;88401000000;88701000;UTC+3;56.6343662;47.8999706;248688;1584
Респ Марий Эл, г. Козьмодемьянск;13;Козьмодемьянск;88415000000;88715000001;UTC+3;56.3334036;46.546675;21262;1583
Респ Мордовия, г. Ардатов;14;Ардатов;89203501000;89603101001;UTC+3;54.8465544;46.2411232;9400;1671
Респ Мордовия, г. Инсар;14;Инсар;89224501000;89624101001;UTC+3;53.8770022;44.3696566;8687;1648
Респ Мордовия, г. Ковылкино;14;Ковылкино;89410000000;89629101001;UTC+3;54.0391072;43.9191539;21307;1892
Респ Мордовия, г. Краснослободск;14;Краснослободск;89234501000;89634101001;UTC+3;54.4248207;43.7845011;10151;1571
Респ Мордовия, г. Рузаевка;14;Рузаевка;89420000000;89643101001;UTC+3;54.0581967;44.9490466;47529;1631
г. Саранск;14;Саранск;89401000000;89701000001;UTC+3;54.1809332;45.1862632;318841;1641
Респ Мордовия, г. Темников;14;Темников;89249501000;89649101001;UTC+3;54.6310583;43.2161099;7247;XII век
г. Москва;78;;45000000000;45000000;UTC+3;55.7540471;37.620405;11514330;1147
Московская обл, Наро-Фоминский р-н, г. Апрелевка;53;Апрелевка;46450506000;46750000006;UTC+3;55.5276918;37.065143;18467;1899
Московская обл, г. Балашиха;53;Балашиха;46404000000;46704000001;UTC+3;55.796389;37.938283;215353;1830
Московская обл, Воскресенский р-н, пгт Белоозерский;53;Белоозерский;46206554000;46606154051;UTC+3;55.4595766;38.4389742;17842;1961
Московская обл, г. Бронницы;53;Бронницы;46405000000;46705000001;UTC+3;55.4255379;38.264145;21102;1453
Московская обл, Наро-Фоминский р-н, г. Верея;53;Верея;46450511000;46750000011;UTC+3;55.3673997;36.1563454;5368;1371
Московская обл, г. Видное;53;Видное;46228501000;46628101001;UTC+3;55.551725;37.7061984;56798;1949
Московская обл, г. Волоколамск;53;Волоколамск;46205501000;46605101001;UTC+3;56.0356499;35.9585112;23386;1135
Московская обл, г. Воскресенск;53;Воскресенск;46206501000;46606101001;UTC+3;55.3071519;38.7027953;91301;1862
Московская обл, Клинский р-н, г. Высоковск;53;Высоковск;46437506000;46737000006;UTC+3;56.3359513;36.5251837;10642;1864
Московская обл, Одинцовский р-н, г. Голицыно;53;Голицыно;46241504000;46641104001;UTC+3;55.6190582;36.9856793;17447;1872
Московская обл, Истринский р-н, г. Дедовск;53;Дедовск;46433506000;46733000006;UTC+3;55.8703276;37.1245043;29280;1911
Московская обл, г. Дзержинский;53;Дзержинский;46411000000;46711000;UTC+3;55.6240869;37.8440276;47125;1380-е
Московская обл, г. Дмитров;53;Дмитров;46415000000;46715000001;UTC+3;56.3477457;37.526672;61454;1154
Московская обл, г. Долгопрудный;53;Долгопрудный;46416000000;46716000;UTC+3;55.9385999;37.5101021;90976;1931
Московская обл, г. Домодедово;53;Домодедово;46409000000;46709000;UTC+3;55.4363283;37.7664984;96123;1900
Московская обл, Орехово-Зуевский р-н, г. Дрезна;53;Дрезна;46449506000;46749000006;UTC+3;55.7443143;38.8498479;11815;1897
Московская обл, г. Дубна;53;Дубна;46418000000;46718000001;UTC+3;56.741786;37.1757223;70569;1956
Московская обл, г. Егорьевск;53;Егорьевск;46422000000;46722000001;UTC+3;55.3830113;39.0358317;70133;1462
Московская обл, г. Жуковский;53;Жуковский;46425000000;46725000001;UTC+3;55.599803;38.1224298;102729;1947
Московская обл, г. Зарайск;53;Зарайск;46429000000;46729000001;UTC+3;54.762456;38.8850978;24648;1146
Московская обл, г. Звенигород;53;Звенигород;46430000000;46730000001;UTC+3;55.7297089;36.8554029;16395;1152
Московская обл, г. Ивантеевка;53;Ивантеевка;46432000000;46732000001;UTC+3;55.9741665;37.9207539;58594;1564
Московская обл, г. Истра;53;Истра;46433000000;46733000001;UTC+3;55.9062267;36.8601454;35106;1589
Московская обл, г. Кашира;53;Кашира;46435000000;46735000001;UTC+3;54.853337;38.1904392;41880;1356
Московская обл, г. Клин;53;Клин;46437000000;46737000001;UTC+3;56.3425605;36.7240032;80584;1317
Московская обл, г. Коломна;53;Коломна;46438000000;46738000001;UTC+3;55.102814;38.7531002;144642;1177
Московская обл, г. Королев;53;Королев;46434000000;46734000;UTC+3;55.9161773;37.8545415;183452;1938
Московская обл, г. Котельники;53;Котельники;46444000000;46739000;UTC+3;55.6597925;37.8631156;32347;XVII век
Московская обл, г. Красноармейск;53;Красноармейск;46443000000;46743000001;UTC+3;56.105426;38.140838;26294;1928
Московская обл, г. Красногорск;53;Красногорск;46439000000;46744000001;UTC+3;55.8317203;37.3295266;116738;1932
Московская обл, Сергиево-Посадский р-н, г. Краснозаводск;53;Краснозаводск;46215503000;46615103001;UTC+3;56.4409979;38.2320307;13432;1916
Московская обл, г. Краснознаменск;53;Краснознаменск;46505000000;46706000001;UTC+3;55.5978959;37.0393709;36057;1952
Московская обл, Одинцовский р-н, г. Кубинка;53;Кубинка;46241510000;46641110001;UTC+3;55.5754955;36.6951995;22918;15 век
Московская обл, Орехово-Зуевский р-н, г. Куровское;53;Куровское;46449511000;46749000011;UTC+3;55.5792277;38.9207723;21821;1646
Московская обл, г. Ликино-Дулёво;53;Ликино-Дулёво;46449000000;46749000001;UTC+3;55.7078257;38.9578093;31331;1930
Московская обл, г. Лобня;53;Лобня;46440000000;46740000001;UTC+3;56.0328881;37.4614035;74350;1902
Московская обл, г. Лосино-Петровский;53;Лосино-Петровский;46442000000;46742000001;UTC+3;55.8713214;38.200599;22550;1708
Московская обл, г. Луховицы;53;Луховицы;46447000000;46747000001;UTC+3;54.9652077;39.0260266;29849;1594
Московская обл, г. Лыткарино;53;Лыткарино;46441000000;46741000;UTC+3;55.5778163;37.9033507;55147;1429
Московская обл, г. Люберцы;53;Люберцы;46448000000;46748000001;UTC+3;55.7003989;37.9606238;171978;1623
Московская обл, г. Можайск;53;Можайск;46445000000;46745000001;UTC+3;55.5069259;36.024043;31388;1231
Московская обл, г. Мытищи;53;Мытищи;46446000000;46746000001;UTC+3;55.9105782;37.7363579;173341;1460
Московская обл, г. Наро-Фоминск;53;Наро-Фоминск;46450000000;46750000001;UTC+3;55.386185;36.734484;64640;1840
Московская обл, г. Ногинск;53;Ногинск;46451000000;46751000001;UTC+3;55.8686133;38.4622104;99762;1389
Московская обл, г. Одинцово;53;Одинцово;46241501000;46641101001;UTC+3;55.6789455;37.263686;139021;1470
Московская обл, г. Озеры;53;Озеры;46456000000;46756000001;UTC+3;54.8541006;38.5599196;25788;1834
Московская обл, г. Орехово-Зуево;53;Орехово-Зуево;46457000000;46757000001;UTC+3;55.8151421;38.9869822;120620;1917
Московская обл, г. Павловский Посад;53;Павловский Посад;46459000000;46759000001;UTC+3;55.7807244;38.6596983;63771;1328
Московская обл, Сергиево-Посадский р-н, г. Пересвет;53;Пересвет;46215505000;46615105001;UTC+3;56.4158326;38.1733534;14142;1948
Московская обл, г. Подольск;53;Подольск;46460000000;46760000001;UTC+3;55.4389322;37.5703482;187956;1559
Московская обл, г. Протвино;53;Протвино;46467000000;46767000001;UTC+3;54.8705984;37.2182749;37308;1960
Московская обл, г. Пушкино;53;Пушкино;46247501000;46647101001;UTC+3;56.0103638;37.8471403;102840;1499
Московская обл, г. Пущино;53;Пущино;46462000000;46762000001;UTC+3;54.8324412;37.6210346;20263;1956
