address;region;city;okato;oktmo;timezone;geo_lat;geo_lon;population;foundation_year
Забайкальский край, г. Чита;24;Чита;76401000000;76701000001;UTC+9;52.0340142;113.4994;323964;1653
Забайкальский край, г. Шилка;24;Шилка;76254501000;76654101;UTC+9;51.8497035;116.0334461;13947;1897
Ивановская обл, г. Вичуга;41;Вичуга;24403000000;24703000001;UTC+3;57.2044698;41.9132201;37609;1925
Ивановская обл, г. Гаврилов Посад;41;Гаврилов Посад;24203501000;24603101001;UTC+3;56.5586946;40.1228906;6434;1434
Ивановская обл, г. Заволжск;41;Заволжск;24205501000;24605101001;UTC+3;57.4918141;42.1375625;12045;19 век
г. Иваново;41;Иваново;24401000000;24701000001;UTC+3;56.9993792;40.9728272;409277;1561
Ивановская обл, г. Кинешма;41;Кинешма;24405000000;24705000001;UTC+3;57.4425463;42.168914;88113;1429
Ивановская обл, г. Комсомольск;41;Комсомольск;24213501000;24613101001;UTC+3;57.0273052;40.3776851;8693;1931
Ивановская обл, г. Кохма;41;Кохма;24207504000;24706000001;UTC+3;56.9324606;41.0931657;29408;1619
Ивановская обл, Кинешемский р-н, г. Наволоки;41;Наволоки;24211504000;24611104001;UTC+3;57.4679066;41.9608002;10207;1775
Ивановская обл, Приволжский р-н, г. Плес;41;Плес;24220504000;24620104001;UTC+3;57.4606031;41.5122672;2341;1410
Ивановская обл, г. Приволжск;41;Приволжск;24220506000;24620106001;UTC+3;57.3805743;41.2808565;16749;1484
Ивановская обл, г. Пучеж;41;Пучеж;24221501000;24621101001;UTC+3;56.9820688;43.1683321;8583;1594
Ивановская обл, г. Родники;41;Родники;24223501000;24623101001;UTC+3;57.1025975;41.7298834;26318;1606
Ивановская обл, г. Тейково;41;Тейково;24407000000;24707000001;UTC+3;56.8542719;40.5353874;34993;XVII век
Ивановская обл, г. Фурманов;41;Фурманов;24231000000;24631101001;UTC+3;57.2539276;41.1054432;36149;1918
Ивановская обл, г. Шуя;41;Шуя;24411000000;24711000001;UTC+3;56.8560234;41.3800939;58528;1394
Ивановская обл, г. Южа;41;Южа;24235501000;24635101001;UTC+3;56.5926877;42.0458099;14170;1628
Ивановская обл, г. Юрьевец;41;Юрьевец;24237501000;24637101;UTC+3;57.3177781;43.1110401;10205;1225
Респ Ингушетия, г. Карабулак;6;Карабулак;26408000000;26710000001;UTC+3;43.3055248;44.9094582;31081;1859
г. Магас;6;Магас;26401000000;26701000001;UTC+3;43.1688611;44.8131207;2505;1995
Респ Ингушетия, г. Малгобек;6;Малгобек;26405000000;26715000001;UTC+3;43.5096646;44.5901963;31076;1934
Респ Ингушетия, г. Назрань;6;Назрань;26406000000;26706000001;UTC+3;43.2257841;44.7645779;93357;1781
Респ Ингушетия, г. Сунжа;6;Сунжа;26230835001;26720000001;UTC+3;43.3204196;45.0476331;64493[3];1845
Иркутская обл, Нижнеудинский р-н, г. Алзамай;42;Алзамай;25228508000;25628105001;UTC+8;55.5551233;98.6643699;6751;1899
Иркутская обл, г. Ангарск;42;Ангарск;25203501000;25703000001;UTC+8;52.544879;103.888543;233765;1948
Иркутская обл, Слюдянский р-н, г. Байкальск;42;Байкальск;25234508000;25634108001;UTC+8;51.5230393;104.1487532;13589;1961
Иркутская обл, Тайшетский р-н, г. Бирюсинск;42;Бирюсинск;25236508000;25636105001;UTC+8;55.9609167;97.8205348;8981;1967
Иркутская обл, г. Бодайбо;42;Бодайбо;25202501000;25602101001;UTC+8;57.8468636;114.1866287;15331;1864
Иркутская обл, г. Братск;42;Братск;25414000000;25714000001;UTC+8;56.1513108;101.6340035;246348;1631
Иркутская обл, Братский р-н, г. Вихоревка;42;Вихоревка;25204503000;25604103001;UTC+8;56.1208145;101.1702926;22528;1957
Иркутская обл, г. Железногорск-Илимский;42;Железногорск-Илимский;25226501000;25626101001;UTC+8;56.5847888;104.114275;26134;1948
Иркутская обл, г. Зима;42;Зима;25420000000;25720000001;UTC+8;53.920693;102.0491772;32522;1743
г. Иркутск;42;Иркутск;25401000000;25701000001;UTC+8;52.2864036;104.2807466;587225;1661
Иркутская обл, г. Киренск;42;Киренск;25220501000;25620101;UTC+8;57.7756595;108.1109412;12652;1630
Иркутская обл, г. Нижнеудинск;42;Нижнеудинск;25228501000;25628101001;UTC+8;54.8968931;99.0314056;37056;1648
Иркутская обл, г. Саянск;42;Саянск;25426000000;25726000001;UTC+8;54.1107238;102.18015;40786;1970
Иркутская обл, г. Свирск;42;Свирск;25427000000;25746000001;UTC+8;53.0842668;103.3364093;13649;19 век
Иркутская обл, г. Слюдянка;42;Слюдянка;25234501000;25634101001;UTC+8;51.6563983;103.7187545;18542;1899
Иркутская обл, г. Тайшет;42;Тайшет;25236501000;25636101001;UTC+8;55.9405334;98.0030145;35481;1897
Иркутская обл, г. Тулун;42;Тулун;25432000000;25732000001;UTC+8;54.557162;100.5780603;44603;1735
Иркутская обл, г. Усолье-Сибирское;42;Усолье-Сибирское;25436000000;25736000001;UTC+8;52.7565808;103.6388109;83364;1669
Иркутская обл, г. Усть-Илимск;42;Усть-Илимск;25438000000;25738000001;UTC+8;57.9430504;102.7415734;86591;1966
Иркутская обл, г. Усть-Кут;42;Усть-Кут;25244501000;25644101001;UTC+8;56.7928178;105.7757343;45061;1631
Иркутская обл, г. Черемхово;42;Черемхово;25445000000;25745000001;UTC+8;53.1369095;103.0901268;52650;1772
Иркутская обл, г. Шелехов;42;Шелехов;25255501000;25655101001;UTC+8;52.2102538;104.0973294;47960;1953
Респ Кабардино-Балкарская, г. Баксан;7;Баксан;83403000000;83703000;UTC+3;43.6819137;43.5345036;36857;1891
Респ Кабардино-Балкарская, г. Майский;7;Майский;83220501000;83620101;UTC+3;43.6281516;44.0517314;26755;19 век
г. Нальчик;7;Нальчик;83401000000;83701000001;UTC+3;43.4845464;43.60713;240095;1724
Респ Кабардино-Балкарская, г. Нарткала;7;Нарткала;83240501000;83640101;UTC+3;43.5578075;43.8575925;31679;1913
Респ Кабардино-Балкарская, г. Прохладный;7;Прохладный;83410000000;83710000;UTC+3;43.7589602;44.0102409;59595;1765
Респ Кабардино-Балкарская, г. Терек;7;Терек;83235501000;83635101;UTC+3;43.4839358;44.1402161;19170;1876
Респ Кабардино-Балкарская, г. Тырныауз;7;Тырныауз;83248501000;83648101;UTC+3;43.3981585;42.9213582;21000;1934
Респ Кабардино-Балкарская, г. Чегем;7;Чегем;83245501000;83645101;UTC+3;43.5671525;43.5865792;17988;1822
Калининградская обл, г. Багратионовск;43;Багратионовск;27203501000;27703000001;UTC+2;54.3866518;20.6418091;6399;1336
Калининградская обл, г. Балтийск;43;Балтийск;27405000000;27705000001;UTC+2;54.6513372;19.9140572;32670;1626
Калининградская обл, г. Гвардейск;43;Гвардейск;27206501000;27706000001;UTC+2;54.6588378;21.0501388;13888;1255
Калининградская обл, г. Гурьевск;43;Гурьевск;27209501000;27707000001;UTC+2;54.770638;20.6039767;12433;1262
Калининградская обл, г. Гусев;43;Гусев;27212501000;27709000001;UTC+2;54.5915455;22.1942445;28260;XVI век
Калининградская обл, г. Зеленоградск;43;Зеленоградск;27215501000;27710000001;UTC+2;54.9600185;20.4753652;13015;1252
г. Калининград;43;Калининград;27401000000;27701000001;UTC+2;54.7074702;20.5073241;431491;1255
Калининградская обл, г. Краснознаменск;43;Краснознаменск;27218501000;27713000001;UTC+2;54.9453423;22.4928745;3522;1576
Калининградская обл, г. Ладушкин;43;Ладушкин;27203505000;27711000001;UTC+2;54.5692156;20.1690153;3788;1314
Калининградская обл, г. Мамоново;43;Мамоново;27203510000;27712000001;UTC+2;54.4646036;19.9453482;7757;1301
Калининградская обл, г. Неман;43;Неман;27221501000;27714000001;UTC+2;55.0316524;22.0324064;11794;1277
Калининградская обл, г. Нестеров;43;Нестеров;27224501000;27715000001;UTC+2;54.6313814;22.5713736;4584;1539
Калининградская обл, г. Озерск;43;Озерск;27227501000;27716000001;UTC+2;54.4084705;22.0134438;4740;1539
Калининградская обл, г. Пионерский;43;Пионерский;27417000000;27717000001;UTC+2;54.9516574;20.2277424;11017;1254
Калининградская обл, г. Полесск;43;Полесск;27230501000;27718000001;UTC+2;54.8625126;21.0998067;7580;1258
Калининградская обл, г. Правдинск;43;Правдинск;27233501000;27719000001;UTC+2;54.4430986;21.0085269;4323;1312
Калининградская обл, Балтийский р-н, г. Приморск;43;Приморск;27405555000;27705000006;UTC+2;54.7311437;19.9981926;1956;1268
Калининградская обл, г. Светлогорск;43;Светлогорск;27420000000;27734000001;UTC+2;54.9439286;20.1514295;10775;1258
Калининградская обл, г. Светлый;43;Светлый;27425000000;27725000001;UTC+2;54.6772897;20.1357595;21380;1640
Калининградская обл, г. Славск;43;Славск;27236501000;27727000001;UTC+2;55.0449714;21.6742367;4614;1292
Калининградская обл, г. Советск;43;Советск;27430000000;27730000001;UTC+2;55.0809336;21.8886106;41709;1288
Калининградская обл, г. Черняховск;43;Черняховск;27239501000;27739000001;UTC+2;54.6244751;21.7969062;40464;1336
Респ Калмыкия, г. Городовиковск;8;Городовиковск;85205501000;85605101001;UTC+3;46.0875083;41.935537;9565;1872
Респ Калмыкия, г. Лагань;8;Лагань;85215501000;85615101;UTC+3;45.3930912;47.3432602;14323;1870
г. Элиста;8;Элиста;85401000000;85701000;UTC+3;46.3083344;44.2702088;103728;1865
Калужская обл, Боровский р-н, г. Балабаново;44;Балабаново;29206505000;29606105;UTC+3;55.1773714;36.6566951;26337;1584
Калужская обл, Жуковский р-н, г. Белоусово;44;Белоусово;29213507000;29613157001;UTC+3;55.0956803;36.677629;8432;1962
Калужская обл, г. Боровск;44;Боровск;29206501000;29606101;UTC+3;55.2130096;36.4926251;12283;1358
Калужская обл, Боровский р-н, г. Ермолино;44;Ермолино;29206507000;29606157;UTC+3;55.1971758;36.5952722;10409;1601
Калужская обл, г. Жиздра;44;Жиздра;29212501000;29612101;UTC+3;53.7521926;34.7386592;5585;1146
Калужская обл, г. Жуков;44;Жуков;29213501000;29613101001;UTC+3;55.0301833;36.7394903;12150;XVII век
г. Калуга;44;Калуга;29401000000;29701000;UTC+3;54.5059848;36.2516245;325185;1371
Калужская обл, г. Киров;44;Киров;29214501000;29614101001;UTC+3;54.0790111;34.3076201;31888;1745
Калужская обл, г. Козельск;44;Козельск;29216501000;29616101;UTC+3;54.0347201;35.780768;18203;XII век
Калужская обл, г. Кондрово;44;Кондрово;29208501000;29608101;UTC+3;54.7959473;35.9274842;16672;1615
Калужская обл, Жуковский р-н, г. Кременки;44;Кременки;29213510000;29613160;UTC+3;54.8862447;37.1168701;11617;XVIII век
Калужская обл, г. Людиново;44;Людиново;29220501000;29620101001;UTC+3;53.8700828;34.4385915;40550;1626
Калужская обл, г. Малоярославец;44;Малоярославец;29223501000;29623101001;UTC+3;55.0177123;36.4633603;30401;1402
Калужская обл, г. Медынь;44;Медынь;29225501000;29625101;UTC+3;54.9689785;35.8872168;8298;1386
Калужская обл, г. Мещовск;44;Мещовск;29227501000;29627101001;UTC+3;54.3191471;35.2816918;4101;1238
Калужская обл, г. Мосальск;44;Мосальск;29229501000;29629101001;UTC+3;54.4824939;34.9872239;4285;1231
Калужская обл, г. Обнинск;44;Обнинск;29415000000;29715000001;UTC+3;55.0943144;36.6121639;104798;1946
Калужская обл, Козельский р-н, г. Сосенский;44;Сосенский;29216504000;29616104;UTC+3;54.0566016;35.9621646;12394;1952
Калужская обл, г. Спас-Деменск;44;Спас-Деменск;29234501000;29634101001;UTC+3;54.409922;34.0189631;4904;1446
Калужская обл, г. Сухиничи;44;Сухиничи;29236501000;29636101001;UTC+3;54.097296;35.3443568;16295;XVIII век
Калужская обл, Тарусский р-н, г. Таруса;44;Таруса;29238501000;29638101001;UTC+3;54.7236477;37.1671;9656;1246
Калужская обл, г. Юхнов;44;Юхнов;29250501000;29650101;UTC+3;54.7446445;35.2424346;7056;1410
Камчатский край, г. Вилючинск;25;Вилючинск;30535000000;30735000;UTC+12;52.9302415;158.4057632;22905;1968
Камчатский край, г. Елизово;25;Елизово;30402000000;30607101;UTC+12;53.1830375;158.3883548;39548;1848
г. Петропавловск-Камчатский;25;Петропавловск-Камчатский;30401000000;30701000;UTC+12;53.036908;158.6559254;179526;1740
Респ Карачаево-Черкесская, г. Карачаевск;9;Карачаевск;91405000000;91705000001;UTC+3;43.7732525;41.9143472;23848;1926
Респ Карачаево-Черкесская, г. Теберда;9;Теберда;91405503000;91705000006;UTC+3;43.4437731;41.7415142;9097;1868
Респ Карачаево-Черкесская, г. Усть-Джегута;9;Усть-Джегута;91235501000;91635101001;UTC+3;44.0838442;41.9711046;30602;1868
г. Черкесск;9;Черкесск;91401000000;91701000001;UTC+3;44.2269425;42.0466704;121439;1825
Респ Карелия, г. Беломорск;10;Беломорск;86204501000;86604101001;UTC+3;64.5378417;34.7799462;11217;XII век
Респ Карелия, Кемский р-н, г. Кемь;10;Кемь;86212501000;86612101001;UTC+3;64.9543539;34.5949263;13061;XIV век
Респ Карелия, г. Кондопога;10;Кондопога;86215501000;86615101001;UTC+3;62.2059817;34.2682122;32978;1563
Респ Карелия, г. Костомукша;10;Костомукша;86406000000;86706000001;UTC+3;64.5889398;30.6016832;28433;1977
Респ Карелия, г. Лахденпохья;10;Лахденпохья;86218501000;86618101001;UTC+3;61.518881;30.1996116;7818;1600
Респ Карелия, г. Медвежьегорск;10;Медвежьегорск;86224501000;86624101001;UTC+3;62.9127626;34.4568489;15536;1916
Респ Карелия, г. Олонец;10;Олонец;86230501000;86630101001;UTC+3;60.9794025;32.9725519;9060;1137
г. Петрозаводск;10;Петрозаводск;86401000000;86701000;UTC+3;61.7891264;34.3596434;263540;1703
Респ Карелия, г. Питкяранта;10;Питкяранта;86233501000;86633101001;UTC+3;61.5757191;31.4640557;11484;19 век
Респ Карелия, г. Пудож;10;Пудож;86242501000;86642101001;UTC+3;61.8058821;36.5329941;9698;1382
Респ Карелия, г. Сегежа;10;Сегежа;86245501000;86645101001;UTC+3;63.7437572;34.3126982;29660;1914
Респ Карелия, г. Сортавала;10;Сортавала;86410000017;86610101001;UTC+3;61.703367;30.6916998;19215;1468
Респ Карелия, г. Суоярви;10;Суоярви;86250501000;86650101001;UTC+3;62.0787293;32.3499386;9763;XVI век
Кемеровская область - Кузбасс, г. Анжеро-Судженск;45;Анжеро-Судженск;32404000000;32704000001;UTC+7;56.0786281;86.0201278;76669;1896
Кемеровская область - Кузбасс, г. Белово;45;Белово;32407000000;32707000001;UTC+7;54.4220968;86.3037373;76752;1726
Кемеровская область - Кузбасс, г. Березовский;45;Березовский;32410000000;32710000001;UTC+7;55.6693513;86.2744459;47292;1965
Кемеровская область - Кузбасс, г. Гурьевск;45;Гурьевск;32413000000;32602101001;UTC+7;54.2859263;85.9475985;24816;1816
Кемеровская область - Кузбасс, г. Калтан;45;Калтан;32415000000;32715000001;UTC+7;53.5210919;87.2771636;21893;1946
г. Кемерово;45;Кемерово;32401000000;32701000001;UTC+7;55.3910651;86.0467781;532884;1918
Кемеровская область - Кузбасс, г. Киселевск;45;Киселевск;32416000000;32716000001;UTC+7;54.0059999;86.6366116;98382;1917
Кемеровская область - Кузбасс, г. Ленинск-Кузнецкий;45;Ленинск-Кузнецкий;32419000000;32719000001;UTC+7;54.6674492;86.1797324;101666;1763
Кемеровская область - Кузбасс, г. Мариинск;45;Мариинск;32422000000;32616101001;UTC+7;56.2127383;87.7454924;40522;1698
Кемеровская область - Кузбасс, г. Междуреченск;45;Междуреченск;32425000000;32725000001;UTC+7;53.6865289;88.0702754;101995;1946
Кемеровская область - Кузбасс, г. Мыски;45;Мыски;32428000000;32728000001;UTC+7;53.7125695;87.8055646;43029;1826
Кемеровская область - Кузбасс, г. Новокузнецк;45;Новокузнецк;32431000000;32731000001;UTC+7;53.794315;87.2142745;547885;1618
Кемеровская область - Кузбасс, г. Осинники;45;Осинники;32434000000;32734000001;UTC+7;53.5988055;87.3371272;45997;1926
Кемеровская область - Кузбасс, г. Полысаево;45;Полысаево;32435000000;32732000001;UTC+7;54.6055;86.2809208;27624;1989
Кемеровская область - Кузбасс, г. Прокопьевск;45;Прокопьевск;32437000000;32737000001;UTC+7;53.8604265;86.7183577;210150;1650
Кемеровская область - Кузбасс, Гурьевский р-н, г. Салаир;45;Салаир;32413504000;32602104001;UTC+7;54.2351735;85.8030733;8263;1626
Кемеровская область - Кузбасс, г. Тайга;45;Тайга;32440000000;32740000001;UTC+7;56.0622131;85.6207182;25330;1896
Кемеровская область - Кузбасс, г. Таштагол;45;Таштагол;32443000000;32627101001;UTC+7;52.759313;87.8476546;23114;1939
Кемеровская область - Кузбасс, г. Топки;45;Топки;32446000000;32631101001;UTC+7;55.2764707;85.6152619;28642;1914
Кемеровская область - Кузбасс, г. Юрга;45;Юрга;32449000000;32749000001;UTC+7;55.7202694;84.8886399;81536;1886
Кировская обл, г. Белая Холуница;46;Белая Холуница;33205501000;33605101001;UTC+3;58.8415239;50.8460699;11232;1764
Кировская обл, г. Вятские Поляны;46;Вятские Поляны;33404000000;33704000;UTC+3;56.2284817;51.0614855;35159;1596
Кировская обл, г. Зуевка;46;Зуевка;33214501000;33614101001;UTC+3;58.4032152;51.1331606;11198;1899
г. Киров;46;Киров;33401000000;33701000001;UTC+3;58.6035264;49.6679304;473668;1181
Кировская обл, г. Кирово-Чепецк;46;Кирово-Чепецк;33407000000;33707000001;UTC+3;58.5559424;50.0316848;80920;1935
Кировская обл, г. Кирс;46;Кирс;33207501000;33607101001;UTC+3;59.340056;52.2414437;10420;1729
Кировская обл, г. Котельнич;46;Котельнич;33410000000;33710000;UTC+3;58.3034832;48.3475597;24979;1143
Кировская обл, г. Луза;46;Луза;33222501000;33622101001;UTC+3;60.6290609;47.2612445;11262;1899
Кировская обл, г. Малмыж;46;Малмыж;33223501000;33623101001;UTC+3;56.5243844;50.6782739;8265;15 век
Кировская обл, г. Мураши;46;Мураши;33224501000;33624101001;UTC+3;59.3955383;48.9638417;6752;1895
Кировская обл, г. Нолинск;46;Нолинск;33227501000;33627101001;UTC+3;57.5597284;49.93575;9556;1668
Кировская обл, г. Омутнинск;46;Омутнинск;33228501000;33628101001;UTC+3;58.6698913;52.1894564;23618;1773
Кировская обл, г. Орлов;46;Орлов;33245501000;33645101001;UTC+3;58.5389776;48.8927723;6959;1459
Кировская обл, г. Слободской;46;Слободской;33413000000;33713000;UTC+3;58.7311574;50.1669249;33983;1505
Кировская обл, г. Советск;46;Советск;33236501000;33636101001;UTC+3;57.584196;48.9590272;16592;XII век
Кировская обл, Вятскополянский р-н, г. Сосновка;46;Сосновка;33210504000;33610104001;UTC+3;56.2532741;51.2833642;11960;1699
Кировская обл, г. Уржум;46;Уржум;33241501000;33641101001;UTC+3;57.1097477;50.0058097;10213;1584
Кировская обл, г. Яранск;46;Яранск;33250501000;33650101001;UTC+3;57.3040326;47.8478737;17252;1584
Респ Коми, г. Воркута;11;Воркута;87410000000;87710000001;UTC+3;67.4974082;64.061034;70551;1936
Респ Коми, г. Вуктыл;11;Вуктыл;87412000000;87712000001;UTC+3;63.8615274;57.3165402;12357;1968
Респ Коми, г. Емва;11;Емва;87208501000;87608101001;UTC+3;62.5965137;50.8732125;14574;1941
Респ Коми, г. Инта;11;Инта;87415000000;87715000001;UTC+3;66.0367316;60.1152961;32021;1940
Респ Коми, Усть-Вымский р-н, г. Микунь;11;Микунь;87244505000;87644105001;UTC+3;62.3579068;50.0719503;10732;1937
Респ Коми, г. Печора;11;Печора;87420550000;87620101001;UTC+3;65.148584;57.2239777;43458;1940
Респ Коми, г. Сосногорск;11;Сосногорск;87422000000;87626122001;UTC+3;63.5989841;53.876293;27809;1939
г. Сыктывкар;11;Сыктывкар;87401000000;87701000001;UTC+3;61.6686617;50.8358151;235006;1780
Респ Коми, г. Усинск;11;Усинск;87423000000;87723000001;UTC+3;65.994147;57.5569423;41100;1966
Респ Коми, г. Ухта;11;Ухта;87425000000;87725000001;UTC+3;63.5565514;53.7014239;99642;1929
Костромская обл, г. Буй;47;Буй;34405000000;34705000001;UTC+3;58.4733277;41.5306822;25763;1536
Костромская обл, г. Волгореченск;47;Волгореченск;34406000000;34706000;UTC+3;57.4424559;41.1594201;17108;1964
Костромская обл, г. Галич;47;Галич;34408000000;34708000;UTC+3;58.3828191;42.3654013;17346;1159
Костромская обл, г. Кологрив;47;Кологрив;34212501000;34612101;UTC+3;58.8269323;44.3184927;3314;XVII век
г. Кострома;47;Кострома;34401000000;34701000001;UTC+3;57.8029621;40.9908264;268617;1152
Костромская обл, г. Макарьев;47;Макарьев;34218501000;34618101;UTC+3;57.8807152;43.8014197;7114;1439
Костромская обл, г. Мантурово;47;Мантурово;34414000000;34714000;UTC+3;58.3265441;44.757494;17479;1617
Костромская обл, г. Нерехта;47;Нерехта;34420000000;34626101;UTC+3;57.4543369;40.5723598;22817;1214
Костромская обл, г. Нея;47;Нея;34422000000;34624101;UTC+3;58.2943349;43.8780948;9827;1906
Костромская обл, г. Солигалич;47;Солигалич;34240501000;34640101;UTC+3;59.0784867;42.2878423;6438;1335
Костромская обл, г. Чухлома;47;Чухлома;34246501000;34646101001;UTC+3;58.753421;42.6884958;5209;1381
Костромская обл, г. Шарья;47;Шарья;34430000000;34730000;UTC+3;58.3760542;45.4062414;23668;1906
Краснодарский край, г. Абинск;26;Абинск;3201501000;3601101001;UTC+3;44.8679655;38.1618157;34926;1863
Краснодарский край, г. Анапа;26;Анапа;3403000000;3703000001;UTC+3;44.8950433;37.3163282;58983;1781
Краснодарский край, г. Апшеронск;26;Апшеронск;3205501000;3605101001;UTC+3;44.4584006;39.7299824;40229;1863
Краснодарский край, г. Армавир;26;Армавир;3405000000;3705000001;UTC+3;45.0012149;41.1324168;188897;1839
Краснодарский край, г. Белореченск;26;Белореченск;3406000000;3608101001;UTC+3;44.7651876;39.8781494;53891;1862
Краснодарский край, г. Геленджик;26;Геленджик;3408000000;3708000;UTC+3;44.5630007;38.0790852;54813;1831
Краснодарский край, г. Горячий Ключ;26;Горячий Ключ;3409000000;3709000001;UTC+3;44.6344864;39.1354738;30093;1868
