address;region;city;okato;oktmo;timezone;geo_lat;geo_lon;population;foundation_year
Респ Адыгея, г. Адыгейск;1;Адыгейск;79403000000;79703000001;UTC+3;44.878414;39.190289;12689;1969
г. Майкоп;1;Майкоп;79401000000;79701000001;UTC+3;44.6098268;40.1006606;144055;1857
г. Горно-Алтайск;2;Горно-Алтайск;84401000000;84701000;UTC+7;51.9581028;85.9603235;62861;1830
Алтайский край, г. Алейск;23;Алейск;1403000000;1703000;UTC+7;52.4922513;82.7793606;28528;1913
г. Барнаул;23;Барнаул;1401000000;1701000;UTC+7;53.3479968;83.7798064;635585;1730
Алтайский край, г. Белокуриха;23;Белокуриха;1404000000;1704000001;UTC+7;51.996152;84.9839604;15072;1846
Алтайский край, г. Бийск;23;Бийск;1405000000;1705000001;UTC+7;52.5393864;85.2138453;203826;1709
Алтайский край, г. Горняк;23;Горняк;1225501000;1625101;UTC+7;50.9979622;81.4643358;13040;1942
Алтайский край, г. Заринск;23;Заринск;1406000000;1706000001;UTC+7;53.7063476;84.9315081;47035;1748
Алтайский край, г. Змеиногорск;23;Змеиногорск;1214501000;1614101;UTC+7;51.1581094;82.1872547;10569;1736
Алтайский край, г. Камень-на-Оби;23;Камень-на-Оби;1216501000;1616101001;UTC+7;53.7913974;81.3545053;41787;1751
Алтайский край, г. Новоалтайск;23;Новоалтайск;1413000000;1713000001;UTC+7;53.4119759;83.9311069;73134;1736
Алтайский край, г. Рубцовск;23;Рубцовск;1416000000;1716000;UTC+7;51.5012067;81.2078695;146386;1892
Алтайский край, г. Славгород;23;Славгород;1419000000;1719000001;UTC+7;52.999463;78.6459232;30370;1910
Алтайский край, г. Яровое;23;Яровое;1430000000;1730000;UTC+7;52.9252146;78.5729775;18085;1943
Амурская обл, г. Белогорск;32;Белогорск;10410000000;10710000;UTC+9;50.9213415;128.4739471;68220;1860
г. Благовещенск;32;Благовещенск;10401000000;10701000;UTC+9;50.290659;127.527198;214397;1856
Амурская обл, г. Завитинск;32;Завитинск;10221501000;10621101;UTC+9;50.1064111;129.4391813;11481;1906
Амурская обл, г. Зея;32;Зея;10412000000;10712000;UTC+9;53.7340088;127.265787;25042;1879
Амурская обл, г. Райчихинск;32;Райчихинск;10420000000;10720000;UTC+9;49.7941615;129.4112492;20499;1932
Амурская обл, г. Свободный;32;Свободный;10430000000;10730000;UTC+9;51.3614103;128.1219729;58594;1912
Амурская обл, г. Сковородино;32;Сковородино;10249501000;10649101;UTC+9;53.9871095;123.9437205;9561;1908
Амурская обл, г. Тында;32;Тында;10432000000;10732000;UTC+9;55.1546441;124.7468904;35574;1907
Амурская обл, г. Циолковский;32;Циолковский;10545000000;10770000001;UTC+9;51.762481;128.1219846;6208;1961
Амурская обл, г. Шимановск;32;Шимановск;10440000000;10740000;UTC+9;52.0051886;127.7005458;19815;1910
г. Архангельск;33;Архангельск;11401000000;11701000;UTC+3;64.5394289;40.5169606;348716;1584
Архангельская обл, г. Вельск;33;Вельск;11205501000;11605101001;UTC+3;61.066;42.1032789;23885;1137
Архангельская обл, г. Каргополь;33;Каргополь;11218501000;11618101001;UTC+3;61.5009724;38.9636966;10148;1447
Архангельская обл, г. Коряжма;33;Коряжма;11408000000;11708000001;UTC+3;61.2885948;47.1003015;39629;1535
Архангельская обл, г. Котлас;33;Котлас;11410000000;11710000001;UTC+3;61.2528972;46.633242;60562;1617
Архангельская обл, г. Мезень;33;Мезень;11242501000;11642101001;UTC+3;65.8398078;44.2532273;3599;XVI век
Архангельская обл, г. Мирный;33;Мирный;11525000000;11725000001;UTC+3;62.7645265;40.3360076;30259;1957
Архангельская обл, г. Новодвинск;33;Новодвинск;11415000000;11715000001;UTC+3;64.4136851;40.8208143;40612;1936
Архангельская обл, г. Няндома;33;Няндома;11244501000;11644101001;UTC+3;61.6654674;40.2062947;22354;1898
Архангельская обл, г. Онега;33;Онега;11420000000;11646101001;UTC+3;63.9162928;38.0805031;21359;1137
Архангельская обл, г. Северодвинск;33;Северодвинск;11430000000;11730000001;UTC+3;64.5625385;39.8180934;192265;1936
Архангельская обл, Котласский р-н, г. Сольвычегодск;33;Сольвычегодск;11227504000;11627104001;UTC+3;61.3319616;46.920441;2460;1492
Архангельская обл, г. Шенкурск;33;Шенкурск;11258501000;11658101001;UTC+3;62.1057272;42.8996973;5702;1137
г. Астрахань;34;Астрахань;12401000000;12701000;UTC+4;46.3655652;48.0559236;520662;1558
Астраханская обл, г. Ахтубинск;34;Ахтубинск;12205501000;12605101;UTC+4;48.2752034;46.1906462;41898;1768
Астраханская обл, г. Знаменск;34;Знаменск;12519000000;12719000;UTC+4;48.5866291;45.7368019;29357;1948
Астраханская обл, г. Камызяк;34;Камызяк;12225501000;12625101;UTC+4;46.110579;48.07333;16291;1560
Астраханская обл, г. Нариманов;34;Нариманов;12240501000;12640101;UTC+4;46.6916565;47.8502476;11386;1963
Астраханская обл, г. Харабали;34;Харабали;12245501000;12645101;UTC+4;47.408999;47.2525345;18209;1789
Респ Башкортостан, г. Агидель;3;Агидель;80403000000;80703000;UTC+5;55.8999056;53.9220144;16365;1980
Респ Башкортостан, г. Баймак;3;Баймак;80404000000;80606101001;UTC+5;52.5912896;58.3110998;17710;1850
Респ Башкортостан, г. Белебей;3;Белебей;80405000000;80609101;UTC+5;54.1034582;54.1113129;60183;1757
Респ Башкортостан, г. Белорецк;3;Белорецк;80410000000;80611101;UTC+5;53.9676488;58.4100419;68804;1762
Респ Башкортостан, г. Бирск;3;Бирск;80415000000;80613101;UTC+5;55.4155753;55.5582214;41637;1663
Респ Башкортостан, г. Благовещенск;3;Благовещенск;80417000000;80615101001;UTC+5;55.0499867;55.9553186;34246;1756
Респ Башкортостан, г. Давлеканово;3;Давлеканово;80419000000;80622101;UTC+5;54.2226707;55.0312373;24040;1730
Респ Башкортостан, г. Дюртюли;3;Дюртюли;80418000000;80624101;UTC+5;55.4848318;54.8524765;31272;1795
Респ Башкортостан, г. Ишимбай;3;Ишимбай;80420000000;80631101;UTC+5;53.4545764;56.0438751;66259;1932
Респ Башкортостан, г. Кумертау;3;Кумертау;80423000000;80723000;UTC+5;52.7564939;55.7970197;62854;1947
Респ Башкортостан, г. Межгорье;3;Межгорье;80507000000;80707000;UTC+5;54.2397689;57.9614547;17353;1979
Респ Башкортостан, г. Мелеуз;3;Мелеуз;80425000000;80641101;UTC+5;52.9589532;55.9282838;61408;1766
Респ Башкортостан, г. Нефтекамск;3;Нефтекамск;80427000000;80727000001;UTC+5;56.088377;54.2483061;121757;1957
Респ Башкортостан, г. Октябрьский;3;Октябрьский;80435000000;80735000001;UTC+5;54.4815311;53.4655972;109379;1937
Респ Башкортостан, г. Салават;3;Салават;80439000000;80739000001;UTC+5;53.3616974;55.9245224;156085;1948
Респ Башкортостан, г. Сибай;3;Сибай;80443000000;80743000001;UTC+5;52.7204651;58.6663783;62732;1925
Респ Башкортостан, г. Стерлитамак;3;Стерлитамак;80445000000;80745000;UTC+5;53.6300864;55.9317089;273432;1766
Респ Башкортостан, г. Туймазы;3;Туймазы;80450000000;80651101;UTC+5;54.5999224;53.6950623;66849;1912
г. Уфа;3;Уфа;80401000000;80701000;UTC+5;54.734944;55.9578468;1062300;1574
Респ Башкортостан, г. Учалы;3;Учалы;80455000000;80653101;UTC+5;54.3067375;59.4125461;37771;сер. XVIII века
Респ Башкортостан, г. Янаул;3;Янаул;80460000000;80659101;UTC+5;56.2650146;54.929907;26988;1730-е
Белгородская обл, г. Алексеевка;35;Алексеевка;14410000000;14710000001;UTC+3;50.6299647;38.6880342;39026;1685
г. Белгород;35;Белгород;14401000000;14701000;UTC+3;50.5976472;36.5856652;356426;1596
Белгородская обл, г. Бирюч;35;Бирюч;14242501000;14642151;UTC+3;50.6484585;38.4005083;7842;1705
Белгородская обл, г. Валуйки;35;Валуйки;14420000000;14720000001;UTC+3;50.2111207;38.0998772;35322;1593
Белгородская обл, г. Грайворон;35;Грайворон;14232501000;14725000001;UTC+3;50.4862958;35.6663877;6234;1678
Белгородская обл, г. Губкин;35;Губкин;14430000000;14730000001;UTC+3;51.2837123;37.5347759;88562;1939
Белгородская обл, г. Короча;35;Короча;14240501000;14640101;UTC+3;50.8129041;37.1896436;5877;1637
Белгородская обл, г. Новый Оскол;35;Новый Оскол;14244501000;14735000001;UTC+3;50.7633747;37.8775484;19530;1637
Белгородская обл, г. Старый Оскол;35;Старый Оскол;14440000000;14740000001;UTC+3;51.2967101;37.8350182;221163;1593
Белгородская обл, г. Строитель;35;Строитель;14258501000;14755000001;UTC+3;50.7845099;36.4887648;23933;1958
Белгородская обл, г. Шебекино;35;Шебекино;14450000000;14750000001;UTC+3;50.4004883;36.8877889;44277;1713
г. Брянск;36;Брянск;15401000000;15701000001;UTC+3;53.2419535;34.3652146;415640;985
Брянская обл, г. Дятьково;36;Дятьково;15216501000;15616104001;UTC+3;53.5958178;34.3551812;29438;1626
Брянская обл, г. Жуковка;36;Жуковка;15222501000;15622101001;UTC+3;53.5340397;33.7302579;18269;1871
Брянская обл, г. Злынка;36;Злынка;15223501000;15623101001;UTC+3;52.4267015;31.7360399;5507;1702
Брянская обл, г. Карачев;36;Карачев;15224501000;15624101001;UTC+3;53.1296524;34.9888727;19715;1146
Брянская обл, г. Клинцы;36;Клинцы;15415000000;15715000001;UTC+3;52.7529119;32.233911;62510;1707
Брянская обл, г. Мглин;36;Мглин;15236501000;15636101001;UTC+3;53.0599771;32.8468129;7916;1387
Брянская обл, г. Новозыбков;36;Новозыбков;15420000000;15720000001;UTC+3;52.537173;31.9357991;40552;1701
Брянская обл, г. Почеп;36;Почеп;15244501000;15644101001;UTC+3;52.9154851;33.4744058;17933;1447
Брянская обл, г. Севск;36;Севск;15248501000;15648101001;UTC+3;52.1483358;34.4918415;7282;1146
Брянская обл, г. Сельцо;36;Сельцо;15425000000;15725000001;UTC+3;53.3739884;34.1059172;17933;1870-е
Брянская обл, г. Стародуб;36;Стародуб;15250501000;15750000;UTC+3;52.5852257;32.760403;19010;1080
Брянская обл, г. Сураж;36;Сураж;15254501000;15654101001;UTC+3;53.0170888;32.3938878;11640;XVII век
Брянская обл, г. Трубчевск;36;Трубчевск;15256501000;15656101001;UTC+3;52.5791734;33.7660547;15014;975
Брянская обл, г. Унеча;36;Унеча;15258501000;15658101001;UTC+3;52.8461199;32.6757629;26196;1887
Брянская обл, г. Фокино;36;Фокино;15216504000;15710000001;UTC+3;53.4554145;34.4159238;13874;1899
Респ Бурятия, Кабанский р-н, г. Бабушкин;4;Бабушкин;81224503000;81624103;UTC+8;51.7112755;105.8673219;4542;1760
Респ Бурятия, г. Гусиноозерск;4;Гусиноозерск;81248501000;81648101001;UTC+8;51.2865048;106.5230319;23280;1939
Респ Бурятия, г. Закаменск;4;Закаменск;81221501000;81621101001;UTC+8;50.372713;103.286699;11249;1934
Респ Бурятия, г. Кяхта;4;Кяхта;81233501000;81633101;UTC+8;50.346543;106.4533516;20013;1727
Респ Бурятия, г. Северобайкальск;4;Северобайкальск;81420000000;81720000001;UTC+8;55.635614;109.3361505;23673;1974
г. Улан-Удэ;4;Улан-Удэ;81401000000;81701000001;UTC+8;51.8335853;107.5842223;431922;1666
Владимирская обл, г. Александров;37;Александров;17205501000;17605101001;UTC+3;56.391819;38.7111123;61544;XIV век
г. Владимир;37;Владимир;17401000000;17701000001;UTC+3;56.1280804;40.4084376;348256;990
Владимирская обл, г. Вязники;37;Вязники;17210501000;17610101001;UTC+3;56.29773;42.2687398;41252;1608
Владимирская обл, г. Гороховец;37;Гороховец;17215501000;17615101001;UTC+3;56.2021036;42.6926111;14015;1158
Владимирская обл, г. Гусь-Хрустальный;37;Гусь-Хрустальный;17420000000;17720000001;UTC+3;55.6198751;40.6579929;60773;1756
Владимирская обл, г. Камешково;37;Камешково;17225501000;17625101001;UTC+3;56.3490152;40.9955183;13113;1892
Владимирская обл, Александровский р-н, г. Карабаново;37;Карабаново;17205505000;17605105001;UTC+3;56.3131822;38.7034257;14868;1630
Владимирская обл, г. Киржач;37;Киржач;17230501000;17630101001;UTC+3;56.1486863;38.8635701;30044;1332
Владимирская обл, г. Ковров;37;Ковров;17425000000;17725000001;UTC+3;56.3554349;41.3170576;145492;XII век
Владимирская обл, г. Кольчугино;37;Кольчугино;17240501000;17640101001;UTC+3;56.3327254;39.391336;45804;1871
Владимирская обл, Петушинский р-н, г. Костерево;37;Костерево;17246510000;17646110001;UTC+3;55.9337222;39.6247398;9136;1890
Владимирская обл, Гусь-Хрустальный р-н, г. Курлово;37;Курлово;17220515000;17620115001;UTC+3;55.452698;40.6124108;6791;1811
Владимирская обл, Собинский р-н, г. Лакинск;37;Лакинск;17250503000;17650110001;UTC+3;56.0180587;39.956551;15707;15 век
Владимирская обл, г. Меленки;37;Меленки;17242501000;17642101001;UTC+3;55.3387515;41.6340046;15208;XVIII век
Владимирская обл, г. Муром;37;Муром;17435000000;17735000001;UTC+3;55.5630311;42.0231362;116078;862
Владимирская обл, г. Петушки;37;Петушки;17246501000;17646101001;UTC+3;55.9298134;39.4508075;15167;1861
Владимирская обл, Петушинский р-н, г. Покров;37;Покров;17246520000;17646120001;UTC+3;55.9166398;39.1734526;17762;1506
Владимирская обл, г. Радужный;37;Радужный;17537000000;17737000001;UTC+3;55.9960277;40.3321855;18212;1971
Владимирская обл, г. Собинка;37;Собинка;17250501000;17650101001;UTC+3;55.9939169;40.0179653;19482;1858
Владимирская обл, Александровский р-н, г. Струнино;37;Струнино;17205508000;17605108001;UTC+3;56.3749967;38.5839667;14372;1492
Владимирская обл, г. Судогда;37;Судогда;17252501000;17652101001;UTC+3;55.9498056;40.8562939;11848;1552
Владимирская обл, г. Суздаль;37;Суздаль;17254501000;17654101001;UTC+3;56.4274441;40.4525692;10535;999
Владимирская обл, г. Юрьев-Польский;37;Юрьев-Польский;17256501000;17656101001;UTC+3;56.4937757;39.6680539;19588;1152
г. Волгоград;38;Волгоград;18401000000;18701000001;UTC+4;48.7070042;44.5170339;1021244;1589
Волгоградская обл, г. Волжский;38;Волжский;18410000000;18710000001;UTC+4;48.7978209;44.7462538;314436;1951
Волгоградская обл, г. Дубовка;38;Дубовка;18208501000;18608101001;UTC+4;49.0554742;44.8270085;14345;1732
Волгоградская обл, г. Жирновск;38;Жирновск;18212501000;18612101001;UTC+4;50.9768814;44.7858202;16890;XVIII век
Волгоградская обл, г. Калач-на-Дону;38;Калач-на-Дону;18216501000;18616101001;UTC+4;48.6889024;43.5306303;26892;1708
Волгоградская обл, г. Камышин;38;Камышин;18415000000;18715000001;UTC+4;50.0651529;45.3844202;119924;1668
Волгоградская обл, г. Котельниково;38;Котельниково;18224501000;18624101001;UTC+4;47.6310259;43.1330872;20441;1897
Волгоградская обл, г. Котово;38;Котово;18226501000;18626101001;UTC+4;50.3205766;44.8030699;24104;1710-е
Волгоградская обл, Среднеахтубинский р-н, г. Краснослободск;38;Краснослободск;18251507000;18651107001;UTC+4;48.7068721;44.5630857;16007;1870
Волгоградская обл, г. Ленинск;38;Ленинск;18230501000;18630101001;UTC+4;48.6936061;45.1992692;15527;1802
Волгоградская обл, г. Михайловка;38;Михайловка;18420000000;18720000001;UTC+4;50.0708719;43.2401512;59153;1762
Волгоградская обл, г. Николаевск;38;Николаевск;18236501000;18636101001;UTC+4;50.0165306;45.4731658;15081;1747
Волгоградская обл, г. Новоаннинский;38;Новоаннинский;18238501000;18638101001;UTC+4;50.5296067;42.6666439;17911;1956
Волгоградская обл, г. Палласовка;38;Палласовка;18245501000;18645101;UTC+4;50.0500944;46.8804277;15984;1907
Волгоградская обл, Камышинский р-н, г. Петров Вал;38;Петров Вал;18218503000;18618103001;UTC+4;50.1380557;45.20914;13264;1942
Волгоградская обл, г. Серафимович;38;Серафимович;18250501000;18650101001;UTC+4;49.5663183;42.7360402;9368;1589
Волгоградская обл, г. Суровикино;38;Суровикино;18253501000;18653101001;UTC+4;48.618917;42.8541163;20527;1744
Волгоградская обл, г. Урюпинск;38;Урюпинск;18425000000;18725000001;UTC+4;50.7903789;42.0288513;41594;1618
Волгоградская обл, г. Фролово;38;Фролово;18428000000;18728000001;UTC+4;49.7649148;43.6648641;39489;1859
Вологодская обл, г. Бабаево;39;Бабаево;19205501000;19605101;UTC+3;59.3892583;35.9377058;12074;15 век
Вологодская обл, г. Белозерск;39;Белозерск;19210501000;19610101;UTC+3;60.0308381;37.7890586;9614;862
Вологодская обл, г. Великий Устюг;39;Великий Устюг;19410000000;19614101001;UTC+3;60.7603913;46.3054414;31664;1147
г. Вологда;39;Вологда;19401000000;19701000001;UTC+3;59.2483905;39.8355662;301642;1147
Вологодская обл, г. Вытегра;39;Вытегра;19222501000;19622101;UTC+3;61.0063465;36.4495137;10490;1710
Вологодская обл, г. Грязовец;39;Грязовец;19224501000;19624101;UTC+3;58.8757553;40.2485362;15528;1538
Вологодская обл, Сокольский р-н, г. Кадников;39;Кадников;19238504000;19638104;UTC+3;59.5037764;40.3441148;4797;1492
Вологодская обл, г. Кириллов;39;Кириллов;19228501000;19628101;UTC+3;59.8591523;38.3748782;7735;1397
Вологодская обл, Великоустюгский р-н, г. Красавино;39;Красавино;19410501000;19614105001;UTC+3;60.9612823;46.4814116;7003;1848
Вологодская обл, г. Никольск;39;Никольск;19234501000;19634101001;UTC+3;59.5351837;45.4576137;8515;XIV век
Вологодская обл, г. Сокол;39;Сокол;19420000000;19638101;UTC+3;59.4758605;40.1114187;38454;1615
Вологодская обл, г. Тотьма;39;Тотьма;19246501000;19646101001;UTC+3;59.9734998;42.7589506;9784;1137
Вологодская обл, г. Устюжна;39;Устюжна;19250501000;19650101001;UTC+3;58.8383117;36.4425478;9478;1252
Вологодская обл, г. Харовск;39;Харовск;19252501000;19652101001;UTC+3;59.9479423;40.2000298;10078;1903
Вологодская обл, г. Череповец;39;Череповец;19430000000;19730000;UTC+3;59.1269212;37.9090497;312311;1777
Воронежская обл, г. Бобров;40;Бобров;20204501000;20604101001;UTC+3;51.0901649;40.0318256;19738;1698
Воронежская обл, г. Богучар;40;Богучар;20205501000;20605101001;UTC+3;49.9352454;40.5590801;11811;1704
Воронежская обл, г. Борисоглебск;40;Борисоглебск;20410000000;20710000001;UTC+3;51.3655754;42.1008334;65585;1698
Воронежская обл, г. Бутурлиновка;40;Бутурлиновка;20208501000;20608101001;UTC+3;50.8311818;40.5976923;27208;1740
г. Воронеж;40;Воронеж;20401000000;20701000001;UTC+3;51.6593332;39.1969229;889680;1586
Воронежская обл, г. Калач;40;Калач;20215501000;20615101001;UTC+3;50.4242134;41.0162014;20046;1716
Воронежская обл, г. Лиски;40;Лиски;20221501000;20621101001;UTC+3;50.9945626;39.5184909;55864;XVI век
Воронежская обл, г. Нововоронеж;40;Нововоронеж;20427000000;20727000001;UTC+3;51.3091524;39.2162843;32635;1957
Воронежская обл, г. Новохоперск;40;Новохоперск;20227501000;20627101001;UTC+3;51.0952211;41.6173404;6849;1710
Воронежская обл, г. Острогожск;40;Острогожск;20231501000;20631101001;UTC+3;50.8677905;39.0407746;33842;1652
Воронежская обл, г. Павловск;40;Павловск;20233501000;20633101001;UTC+3;50.453455;40.136874;25126;1709
Воронежская обл, г. Поворино;40;Поворино;20239501000;20639101001;UTC+3;51.1954419;42.2472726;17692;1870
Воронежская обл, г. Россошь;40;Россошь;20247501000;20647101001;UTC+3;50.1701949;39.6226965;62865;XVII век
Воронежская обл, г. Семилуки;40;Семилуки;20249501000;20649101001;UTC+3;51.6951644;39.0190454;26025;1615
Воронежская обл, г. Эртиль;40;Эртиль;20258501000;20658101001;UTC+3;51.830932;40.8074182;11387;1897
Респ Дагестан, г. Буйнакск;5;Буйнакск;82405000000;82705000;UTC+3;42.8214424;47.1165263;65735;1834
Респ Дагестан, г. Дагестанские Огни;5;Дагестанские Огни;82408000000;82708000001;UTC+3;42.1152296;48.1939354;30671;1914
Респ Дагестан, г. Дербент;5;Дербент;82410000000;82710000;UTC+3;42.058966;48.2907452;119961;438
Респ Дагестан, г. Избербаш;5;Избербаш;82415000000;82715000;UTC+3;42.5650962;47.8710051;56301;1932
Респ Дагестан, г. Каспийск;5;Каспийск;82420000000;82720000;UTC+3;42.8916007;47.6367066;103914;1932
Респ Дагестан, г. Кизилюрт;5;Кизилюрт;82425000000;82725000;UTC+3;43.203825;46.8729636;36187;1963
Респ Дагестан, г. Кизляр;5;Кизляр;82430000000;82730000;UTC+3;43.8484083;46.7233699;49169;1735
г. Махачкала;5;Махачкала;82401000000;82701000;UTC+3;42.9849159;47.5047181;577990;1844
Респ Дагестан, г. Хасавюрт;5;Хасавюрт;82435000000;82735000001;UTC+3;43.2504665;46.5851292;133929;1846
Респ Дагестан, г. Южно-Сухокумск;5;Южно-Сухокумск;82438000000;82738000;UTC+3;44.6602467;45.6499523;10048;1958
г. Биробиджан;81;Биробиджан;99401000000;99701000;UTC+10;48.7946446;132.9217207;75419;1915
Еврейская Аобл, г. Облучье;81;Облучье;99220501000;99620101001;UTC+10;49.0189345;131.0540102;9379;1911
Забайкальский край, г. Балей;24;Балей;76206501000;76606101001;UTC+9;51.5823759;116.6379549;12536;1736
Забайкальский край, г. Борзя;24;Борзя;76209501000;76609101001;UTC+9;50.3876058;116.5234779;31376;1899
Забайкальский край, г. Краснокаменск;24;Краснокаменск;76221501000;76621101;UTC+9;50.0929703;118.0323936;55668;1967
Забайкальский край, г. Могоча;24;Могоча;76226501000;76626101001;UTC+9;53.7361398;119.7660867;13228;1910
Забайкальский край, г. Нерчинск;24;Нерчинск;76228501000;76628101;UTC+9;51.9594977;116.5852383;14976;1653
Забайкальский край, г. Петровск-Забайкальский;24;Петровск-Забайкальский;76236501000;76715000001;UTC+9;51.2748592;108.846681;18555;1789
Забайкальский край, г. Сретенск;24;Сретенск;76240501000;76640101001;UTC+9;52.2461454;117.7117842;6850;1689
Забайкальский край, г. Хилок;24;Хилок;76247501000;76647101001;UTC+9;51.3634856;110.4590898;11530;1895
